User Name,Sex,Comments,Likes,Replies
scretbase,保密,"《黑神话悟空》——主创
翻过那座山，前方是爬不完的峰峦
趟过那条河，身上是拧不干的冷汗
蟠桃宴的座次与你无关
生死簿的名字涂抹增删
命运的绝句从不押韵
英雄的结局大多平淡，偶尔不堪
意料之外的金刚琢，永不回岸的无底船
每个传奇的故事里，都没有白给的仙丹
祝福所有的泪与伤，血与汗，梦想与苦难
唯愿你认真享受每一场战斗
肆无忌惮的格挡、闪避、变化、呼喊
用尽全部运气与勇敢
饱尝一切荣辱与悲欢",18233,"刚翻过了几座山
又越过了几条河
崎岖坎坷怎么他就这么多
（俺老孙去也——哎！）
去你个山更险来水更恶
难也遇过
苦也吃过
走出个通天大道
宽又阔——！！！"
尘梦舟,男,"以前小的时候会一直让爷爷帮我砍后院的竹子，挥舞竹棒，幻想着自己也可以称为齐天大圣，棒下无敌手。
大了一点，看过了很多动漫，电视作品，印象最深的还是《星游记》，麦当就像一只小猴子，有几分悟空的影子。看过雄兵连，看过大圣归来，可以说每个少年的梦里或多或少都出现过孙悟空的影子。
自己有段时期，可以说是迷恋了《悟空传》，看了《西游日记》，也在那段时间第一次看到了斗战神的CG，斗战神没玩过，但是CG看完了，只能说幼小的心灵确实深受震撼。
现在的《黑神话·悟空》就像一颗从无而有的明星，又一次擦亮了儿时的梦。
从今天开始存钱，一天一块",7812,我爷爷是木匠，我小时候专门给我做了一根带油彩的金箍棒，天天拿着棍子出去跑风。前天搬家拆桌子，拆下来一根桌腿，拿在手里不自觉地耍花棍，耍了几圈怔住了…
吃Bagel的莫扎特,男,全世界的素材库里面的中国文化相关的模型动画素材加在一起，应该都没有这个游戏几个宣传片里面的多，个人或者小团队想开发一个发生在我们自己脚下的独立游戏，算算建模动画，就不敢做了，从美术这个方面来说，不管怎么样，这个游戏已经成功了。,63112,对，之前看到一位视频主分享游戏科学的采访和演讲梳理，里面有提到中式素材，游科说他们在游戏发售后会考虑把素材分享出来。
吃Bagel的莫扎特,男,全世界的素材库里面的中国文化相关的模型动画素材加在一起，应该都没有这个游戏几个宣传片里面的多，个人或者小团队想开发一个发生在我们自己脚下的独立游戏，算算建模动画，就不敢做了，从美术这个方面来说，不管怎么样，这个游戏已经成功了。,63112,回复 @百八真珠 :非常感谢分享，但是分享出来也就是完成了一小部分，你能想象中国现代街景建筑的地图素材都找不到吗？现在就是这样[热词系列_哇酷哇酷]
星尘碎影,男,最大的愿望，是黑神话能够成为中国单机新的开端而不是巅峰，不管成功与否也能后继有人，迎来国内游戏领域新时代。,50111,应该会是的，我感觉猴哥在“艺术”领域经常是当开端先锋的那个，西游记、大闹天宫、大圣归来、黑神话。
星尘碎影,男,最大的愿望，是黑神话能够成为中国单机新的开端而不是巅峰，不管成功与否也能后继有人，迎来国内游戏领域新时代。,50111,"黑神话游戏里的流浪地球[脱单doge]
我最喜欢郭导一句话:活下去，只要活下去就会有第二部第三部"
星尘碎影,男,最大的愿望，是黑神话能够成为中国单机新的开端而不是巅峰，不管成功与否也能后继有人，迎来国内游戏领域新时代。,50111,回复 @屑小枫 :希望黑神话活下去这样就会有第二部第三部[笑哭]
英伟达GeForce,保密,2024.8.20，直面天命。PC 版将支持光线追踪与 DLSS 3[打call],37864,来抽张显卡
英伟达GeForce,保密,2024.8.20，直面天命。PC 版将支持光线追踪与 DLSS 3[打call],37864,支援我个4090玩黑神话[吃瓜]
英伟达GeForce,保密,2024.8.20，直面天命。PC 版将支持光线追踪与 DLSS 3[打call],37864,在？你那里今年还有无藏货，别藏了，快端上来罢[doge][doge]
丶葵花籽,保密,艺术价值太高了，不管玩法如何就这中式美学值得我买一份典藏。,28202,就爱这种文化遗产的数字展现
丶葵花籽,保密,艺术价值太高了，不管玩法如何就这中式美学值得我买一份典藏。,28202,确实是独属国人的艺术了，中国文化熏陶下才能感受这种美感
丶葵花籽,保密,艺术价值太高了，不管玩法如何就这中式美学值得我买一份典藏。,28202,回复 @blue_rain- :全世界都喜欢[脱单doge]美的东西大家都会喜欢的
弓手冬郎,男,"‍字幕提到的1592年，是万历二十年，壬辰年，是世德堂本《西游记》出版的年份。
万历二十年五月初四，世德堂本《西游记》刊刻成书，陈元之作序，正式发行。",24267,那只通天河的老鼋，不知有没有修成正果[吃瓜]
弓手冬郎,男,"‍字幕提到的1592年，是万历二十年，壬辰年，是世德堂本《西游记》出版的年份。
万历二十年五月初四，世德堂本《西游记》刊刻成书，陈元之作序，正式发行。",24267,那，这个呢就叫做专业.jpg
弓手冬郎,男,"‍字幕提到的1592年，是万历二十年，壬辰年，是世德堂本《西游记》出版的年份。
万历二十年五月初四，世德堂本《西游记》刊刻成书，陈元之作序，正式发行。",24267,回复 @卧月明moon :驮天命人一程得个因缘果报[脱单doge]
亘古刹那_,男,真的看哭了，国产游戏真的有一天能做的这么好，从小学到现在玩了十几年游戏了一直都在心心念念一款属于我们中国人浪漫的高品质单机游戏，谢谢游科圆了我的梦想，我能做的唯一贡献就是发售当天买一份黄金版，再次致敬！！[大哭],19321,在国内敢做这类游戏的没点梦想还真做不了，能做好而且能大卖绝对能给国内刮起一阵风。
亘古刹那_,男,真的看哭了，国产游戏真的有一天能做的这么好，从小学到现在玩了十几年游戏了一直都在心心念念一款属于我们中国人浪漫的高品质单机游戏，谢谢游科圆了我的梦想，我能做的唯一贡献就是发售当天买一份黄金版，再次致敬！！[大哭],19321,回复 @脚车破尼z : 要有魄力和人脉，全中国也就游戏科学团队既有资历又有人脉，有胆量敢做这种高成本高风险项目
陆迟不是路痴,保密,面捕水平相比去年有了肉眼可见的提升，剧情演出尤其是大场面的演出有点令人难以置信的强大，跳到白龙身上那段真的战神4的味儿太足了，同时也有古墓丽影9或者泰坦陨落2演出的电影质感，虽然片段只有短短几秒，但是沉浸感特别足，太棒了,17884,还有抗争天命的那个背生八臂的怪，那个场景，相机近景晃动，太有新战神的味了！
陆迟不是路痴,保密,面捕水平相比去年有了肉眼可见的提升，剧情演出尤其是大场面的演出有点令人难以置信的强大，跳到白龙身上那段真的战神4的味儿太足了，同时也有古墓丽影9或者泰坦陨落2演出的电影质感，虽然片段只有短短几秒，但是沉浸感特别足，太棒了,17884,配音水平也提高了
陆迟不是路痴,保密,面捕水平相比去年有了肉眼可见的提升，剧情演出尤其是大场面的演出有点令人难以置信的强大，跳到白龙身上那段真的战神4的味儿太足了，同时也有古墓丽影9或者泰坦陨落2演出的电影质感，虽然片段只有短短几秒，但是沉浸感特别足，太棒了,17884,回复 @帝尘心 :这水平我只在英雄联盟中见过，台词太好了
低冷の节操ZI菌,男,我觉得最可怕的是，今晚所有播片看完，我甚至在幻想。明年年度提名，有这个名字[笑哭][笑哭]，只要保持试玩的质量，和pv的表现力，真的，说不准的,15625,一样，做个梦，年度不敢想，最佳动作冒险和最佳叙事提名
低冷の节操ZI菌,男,我觉得最可怕的是，今晚所有播片看完，我甚至在幻想。明年年度提名，有这个名字[笑哭][笑哭]，只要保持试玩的质量，和pv的表现力，真的，说不准的,15625,回复 @剁椒余头 :其实可以想一想，因为24年竞争好像不是很激烈[妙啊]
辣条波比bro,男,最后一幕的画中情愫真让人感慨啊，大闹天宫，压500年，西行取经，成佛，孙悟空的传奇一生就从拜师学艺这里开始，现在轮到屏幕前的人接下这份传承了,15038,1592年也是龙年，2024也是龙年[大哭][大哭][大哭][大哭][大哭]这浪漫谁懂啊各位
辣条波比bro,男,最后一幕的画中情愫真让人感慨啊，大闹天宫，压500年，西行取经，成佛，孙悟空的传奇一生就从拜师学艺这里开始，现在轮到屏幕前的人接下这份传承了,15038,还别说，感觉整个西游记既不是开始于石猴降世，也不是开始于唐僧救悟空，反而是开始于斜月三星洞学法，从那之后猴子才不再是猴子而是孙悟空[点赞]
辣条波比bro,男,最后一幕的画中情愫真让人感慨啊，大闹天宫，压500年，西行取经，成佛，孙悟空的传奇一生就从拜师学艺这里开始，现在轮到屏幕前的人接下这份传承了,15038,回复 @超级无敌大黄编号9527 :2024年8月20还是猴哥生日呢[吃瓜][吃瓜]
方鹤梦,保密,不建议大家刚出新手村就去打小白龙，因为这个时候装备技能都不到位，大家可以出新手村的话，先去后边儿有一个寺庙，寺庙里边有宝箱，去开一个装备。这个时候的话，大家的攻击力和血量也就差不多能打了，然后打完小白龙之后，可以多次去刷一下这个小白龙。因为小白龙它会掉落一个《洞玄子》的技能。在后续类似蜘蛛精的一些关卡很有用,14017,这种症状多久了[脱单doge]
方鹤梦,保密,不建议大家刚出新手村就去打小白龙，因为这个时候装备技能都不到位，大家可以出新手村的话，先去后边儿有一个寺庙，寺庙里边有宝箱，去开一个装备。这个时候的话，大家的攻击力和血量也就差不多能打了，然后打完小白龙之后，可以多次去刷一下这个小白龙。因为小白龙它会掉落一个《洞玄子》的技能。在后续类似蜘蛛精的一些关卡很有用,14017,好家伙，游戏还没出，攻略先有了[doge]
方鹤梦,保密,不建议大家刚出新手村就去打小白龙，因为这个时候装备技能都不到位，大家可以出新手村的话，先去后边儿有一个寺庙，寺庙里边有宝箱，去开一个装备。这个时候的话，大家的攻击力和血量也就差不多能打了，然后打完小白龙之后，可以多次去刷一下这个小白龙。因为小白龙它会掉落一个《洞玄子》的技能。在后续类似蜘蛛精的一些关卡很有用,14017,又疯了一个
水莲葵,保密,真的好期待黑神话悟空啊，我一直到现在也没有玩过什么电脑游戏，希望到时候黑神话悟空能给我一个大惊喜。我最期待的不是一款动作游戏的巅峰，而是一款真真正正用心搞好了我们汉语配音的优秀作品，有游戏的配乐，过场的台词，平时待机的语音，进行各种各样的动作后响应的配音，对话能真的给我感觉到这就是我们中国人平时就是这样说话的感觉。真的真的很期待一款配音优秀的中国作品。,11086,"不是这类游戏受众的话不建议买，因为买了玩就是折磨自己。
我玩怪物猎人世界的时候打三四天同一个怪就打过一次[笑哭]"
水莲葵,保密,真的好期待黑神话悟空啊，我一直到现在也没有玩过什么电脑游戏，希望到时候黑神话悟空能给我一个大惊喜。我最期待的不是一款动作游戏的巅峰，而是一款真真正正用心搞好了我们汉语配音的优秀作品，有游戏的配乐，过场的台词，平时待机的语音，进行各种各样的动作后响应的配音，对话能真的给我感觉到这就是我们中国人平时就是这样说话的感觉。真的真的很期待一款配音优秀的中国作品。,11086,剧情党呢[微笑]风灵月影宗
水莲葵,保密,真的好期待黑神话悟空啊，我一直到现在也没有玩过什么电脑游戏，希望到时候黑神话悟空能给我一个大惊喜。我最期待的不是一款动作游戏的巅峰，而是一款真真正正用心搞好了我们汉语配音的优秀作品，有游戏的配乐，过场的台词，平时待机的语音，进行各种各样的动作后响应的配音，对话能真的给我感觉到这就是我们中国人平时就是这样说话的感觉。真的真的很期待一款配音优秀的中国作品。,11086,回复 @w呜呼呜呼w :无妨，作为手残玩家我已经先玩只狼练手了[doge]，到时候哪怕受虐我也得玩黑神话
龙尔科,保密,，雨水不是穿模贴图雨，而是有实实在在的粒子碰撞的...落到木片上会有水花...还有比较少有人提到的，后面卷起地上很多经文黄纸的，也不是固定是贴图动画，后面龙的动作美术功底不得了，这动作关节甚至比人类还难做（只能硬抠，连动捕都没办法做），加上各种体位姿态间自然地衔接、受击反馈、场景交互，算是真正意义上把中国龙给做活了。这品质，在国内肯定算是第一梯队3A巨作了（老张个人感觉：顶级），虽然实机也暴露了一丝小问题，包括首部宣传片大闹天宫的掉帧，但这反而说明游戏能做出来。这比各种宣传片杀遍天、发行后大幅阉割的游戏要好的多。▌考据太严谨了游戏中的建筑、雕刻、塑像都有现实出处、考据严谨。如二十八星宿彩塑像，设计取材自山西省晋城市玉皇庙，推测塑自元代，或由大雕塑家刘元（刘銮）塑造。博采众长，吸收印度、尼泊尔手法，又有欧洲希腊风格，集两宋、辽、金、元塑像艺术成就之大成。神态、着装、貌形，元素间和谐统一，弱化了本身动物的特征，把性格特征剥离出来，表于外，更加拟人拜佛的这个白皮肤和尚，从颜色和服装判断，应该是以前原画展示的原创角色“观音禅院-空性”妖僧）贴金和胎体几度修复过。左右两个柱子上贴了对楹联，写着“红尘不到真仙境，净土招提好道场”，出自原著65回《妖邪假设小雷音 四众皆遭大厄难》，可以判断这边景色都属于小雷音寺。其实很长一段时间，提到雕塑，大家想到的都是欧洲、米开朗琪罗。其实我国也有如此了不得的塑像家（讲真以前真没看到过），《黑神话 悟空》让这些时光重映在你我眼前。现实中除了殿内，正殿顶上还有琉璃的二十八宿像，泽州东元庆匠人李道真制作，讲真这个大头莫名的还挺萌。然后是一排石刻，这个是取材自重庆大足石刻的宝顶山摩崖石刻的18号龛《观无量寿佛经变相为唐、五代、宋时期凿造，明清续凿，世界文化遗产、八大石窟之一，公元9~13世纪世界石窟艺术最高水平，人类石窟艺术史最后的丰碑。人物更加生活化、写实化。那个巨大的贴金千手观音也是来自大足石刻的宝顶山，寓意“渡一切苦难”自南宋淳熙至淳祐年间开凿，距今约800多年了，还有一上来给了特写的不是普通柱子，是经幢（chuáng）取材自山西省五台山佛光寺，佛光寺是梁思成先生跑遍全国找到的极少数真唐代建筑（重建），始建于北魏孝文帝时期。经幢是用石头记载经文用的，可以持久不毁。经幢上字迹几乎看不出来了，还好是4K宣传片，放大后看到，刻的是《佛顶尊胜陀罗尼,11040,这视频才出多长时间就分析这么多，牛
龙尔科,保密,，雨水不是穿模贴图雨，而是有实实在在的粒子碰撞的...落到木片上会有水花...还有比较少有人提到的，后面卷起地上很多经文黄纸的，也不是固定是贴图动画，后面龙的动作美术功底不得了，这动作关节甚至比人类还难做（只能硬抠，连动捕都没办法做），加上各种体位姿态间自然地衔接、受击反馈、场景交互，算是真正意义上把中国龙给做活了。这品质，在国内肯定算是第一梯队3A巨作了（老张个人感觉：顶级），虽然实机也暴露了一丝小问题，包括首部宣传片大闹天宫的掉帧，但这反而说明游戏能做出来。这比各种宣传片杀遍天、发行后大幅阉割的游戏要好的多。▌考据太严谨了游戏中的建筑、雕刻、塑像都有现实出处、考据严谨。如二十八星宿彩塑像，设计取材自山西省晋城市玉皇庙，推测塑自元代，或由大雕塑家刘元（刘銮）塑造。博采众长，吸收印度、尼泊尔手法，又有欧洲希腊风格，集两宋、辽、金、元塑像艺术成就之大成。神态、着装、貌形，元素间和谐统一，弱化了本身动物的特征，把性格特征剥离出来，表于外，更加拟人拜佛的这个白皮肤和尚，从颜色和服装判断，应该是以前原画展示的原创角色“观音禅院-空性”妖僧）贴金和胎体几度修复过。左右两个柱子上贴了对楹联，写着“红尘不到真仙境，净土招提好道场”，出自原著65回《妖邪假设小雷音 四众皆遭大厄难》，可以判断这边景色都属于小雷音寺。其实很长一段时间，提到雕塑，大家想到的都是欧洲、米开朗琪罗。其实我国也有如此了不得的塑像家（讲真以前真没看到过），《黑神话 悟空》让这些时光重映在你我眼前。现实中除了殿内，正殿顶上还有琉璃的二十八宿像，泽州东元庆匠人李道真制作，讲真这个大头莫名的还挺萌。然后是一排石刻，这个是取材自重庆大足石刻的宝顶山摩崖石刻的18号龛《观无量寿佛经变相为唐、五代、宋时期凿造，明清续凿，世界文化遗产、八大石窟之一，公元9~13世纪世界石窟艺术最高水平，人类石窟艺术史最后的丰碑。人物更加生活化、写实化。那个巨大的贴金千手观音也是来自大足石刻的宝顶山，寓意“渡一切苦难”自南宋淳熙至淳祐年间开凿，距今约800多年了，还有一上来给了特写的不是普通柱子，是经幢（chuáng）取材自山西省五台山佛光寺，佛光寺是梁思成先生跑遍全国找到的极少数真唐代建筑（重建），始建于北魏孝文帝时期。经幢是用石头记载经文用的，可以持久不毁。经幢上字迹几乎看不出来了，还好是4K宣传片，放大后看到，刻的是《佛顶尊胜陀罗尼,11040,出期视频吧[星星眼]
龙尔科,保密,，雨水不是穿模贴图雨，而是有实实在在的粒子碰撞的...落到木片上会有水花...还有比较少有人提到的，后面卷起地上很多经文黄纸的，也不是固定是贴图动画，后面龙的动作美术功底不得了，这动作关节甚至比人类还难做（只能硬抠，连动捕都没办法做），加上各种体位姿态间自然地衔接、受击反馈、场景交互，算是真正意义上把中国龙给做活了。这品质，在国内肯定算是第一梯队3A巨作了（老张个人感觉：顶级），虽然实机也暴露了一丝小问题，包括首部宣传片大闹天宫的掉帧，但这反而说明游戏能做出来。这比各种宣传片杀遍天、发行后大幅阉割的游戏要好的多。▌考据太严谨了游戏中的建筑、雕刻、塑像都有现实出处、考据严谨。如二十八星宿彩塑像，设计取材自山西省晋城市玉皇庙，推测塑自元代，或由大雕塑家刘元（刘銮）塑造。博采众长，吸收印度、尼泊尔手法，又有欧洲希腊风格，集两宋、辽、金、元塑像艺术成就之大成。神态、着装、貌形，元素间和谐统一，弱化了本身动物的特征，把性格特征剥离出来，表于外，更加拟人拜佛的这个白皮肤和尚，从颜色和服装判断，应该是以前原画展示的原创角色“观音禅院-空性”妖僧）贴金和胎体几度修复过。左右两个柱子上贴了对楹联，写着“红尘不到真仙境，净土招提好道场”，出自原著65回《妖邪假设小雷音 四众皆遭大厄难》，可以判断这边景色都属于小雷音寺。其实很长一段时间，提到雕塑，大家想到的都是欧洲、米开朗琪罗。其实我国也有如此了不得的塑像家（讲真以前真没看到过），《黑神话 悟空》让这些时光重映在你我眼前。现实中除了殿内，正殿顶上还有琉璃的二十八宿像，泽州东元庆匠人李道真制作，讲真这个大头莫名的还挺萌。然后是一排石刻，这个是取材自重庆大足石刻的宝顶山摩崖石刻的18号龛《观无量寿佛经变相为唐、五代、宋时期凿造，明清续凿，世界文化遗产、八大石窟之一，公元9~13世纪世界石窟艺术最高水平，人类石窟艺术史最后的丰碑。人物更加生活化、写实化。那个巨大的贴金千手观音也是来自大足石刻的宝顶山，寓意“渡一切苦难”自南宋淳熙至淳祐年间开凿，距今约800多年了，还有一上来给了特写的不是普通柱子，是经幢（chuáng）取材自山西省五台山佛光寺，佛光寺是梁思成先生跑遍全国找到的极少数真唐代建筑（重建），始建于北魏孝文帝时期。经幢是用石头记载经文用的，可以持久不毁。经幢上字迹几乎看不出来了，还好是4K宣传片，放大后看到，刻的是《佛顶尊胜陀罗尼,11040,回复 @秦大壮灬 :很多是以前视频的分析
夜神不说话,男,"[脱单doge]贯穿全片的壁画，画风来源是山西芮城永乐宫壁画，画面结构来源是《释迦源流应化事迹》。
不要问我怎么知道的，直播Reaction的时候突然知识点就跳进我的脑子了，耗时一分钟。
逐帧分析已经在做了！今天晚上不做完不睡觉！晚上见！",6964,好好好
夜神不说话,男,"[脱单doge]贯穿全片的壁画，画风来源是山西芮城永乐宫壁画，画面结构来源是《释迦源流应化事迹》。
不要问我怎么知道的，直播Reaction的时候突然知识点就跳进我的脑子了，耗时一分钟。
逐帧分析已经在做了！今天晚上不做完不睡觉！晚上见！",6964,哈哈哈，我家哎[点赞][点赞]
夜神不说话,男,"[脱单doge]贯穿全片的壁画，画风来源是山西芮城永乐宫壁画，画面结构来源是《释迦源流应化事迹》。
不要问我怎么知道的，直播Reaction的时候突然知识点就跳进我的脑子了，耗时一分钟。
逐帧分析已经在做了！今天晚上不做完不睡觉！晚上见！",6964,俺们山西别的没有那种大大小小的寺庙佛像壁画，真的是管够
睡觉了zZ,保密,这下放心了，视频里人物们争论的是是非善恶这一为人修心之道，也是西游原著的主题。而不是之前一群人盛传的诸如蟠桃论这种嚼吴闲云剩饭的厚黑阴谋论。[给心心],6821,就是要惩恶扬善的价值观[星星眼]
睡觉了zZ,保密,这下放心了，视频里人物们争论的是是非善恶这一为人修心之道，也是西游原著的主题。而不是之前一群人盛传的诸如蟠桃论这种嚼吴闲云剩饭的厚黑阴谋论。[给心心],6821,阴谋论压根就不可能，第一个预告片就暗示了这点
睡觉了zZ,保密,这下放心了，视频里人物们争论的是是非善恶这一为人修心之道，也是西游原著的主题。而不是之前一群人盛传的诸如蟠桃论这种嚼吴闲云剩饭的厚黑阴谋论。[给心心],6821,回复 @娩兒：re :主要是宣言这一类言论的up可真不少，其中可不乏百万粉的up
逍遥大吃货,男,"本性圆明道自通，翻身跳出网罗中。
修成变化非容易，炼就长生岂俗同？
清浊几番随运转，辟开数劫任西东。
逍遥万亿年无计，一点神光永注空。",4281,此诗暗合孙大圣的道妙😁
逍遥大吃货,男,"本性圆明道自通，翻身跳出网罗中。
修成变化非容易，炼就长生岂俗同？
清浊几番随运转，辟开数劫任西东。
逍遥万亿年无计，一点神光永注空。",4281,你自小时走到老，老了再小，老小千番也还难；只要你见性志诚，念念回首处，即是灵山。
逍遥大吃货,男,"本性圆明道自通，翻身跳出网罗中。
修成变化非容易，炼就长生岂俗同？
清浊几番随运转，辟开数劫任西东。
逍遥万亿年无计，一点神光永注空。",4281,回复 @狂三一体 :取经全靠孙悟空，还要我大圣开导他唐僧[doge]
御风彡彡,保密,没有别的意思，只是客观说，比GTA6早发售一年、没有撞上挺好的，GTA6光芒太强了,3669,确实不撞挺好的 但是 有一说一 去年就基本确定了24年夏天发售的 不是为了GTA6定的时间
御风彡彡,保密,没有别的意思，只是客观说，比GTA6早发售一年、没有撞上挺好的，GTA6光芒太强了,3669,撞上也没啥吧，我都会玩的，又不是同一种类型，而且gta首发还不上pc
