User Name,Sex,Comments,Likes,Replies
TM我是教授,保密,终于在发大水后，坚定的买了PS5上的数字豪华版。想我，一直希望能做出些让自己骄傲的游戏，可惜那么多年过去了，还是没有什么成就。对于中国第一个3A的游戏团队，怎么都应该支持一下。这几天桂林发大水，我家及我好几个朋友 都全家被淹了。损失惨重，但是，拿出369元支持你们，这钱还是有的。加油，做中国人骄傲的游戏！,12,老哥注意安全，注意生活
恐怕没文化,保密,今年的贺岁呢,12,2月14号
符玄符卿,男,"一结局
“这天命，你还想要吗”",13,
黑神话-悟空的小粉丝,男,七十遍了[脱单doge][打call],18,你们怎么看到数据
點解咁鬼窮,保密,很久没有看一个宣传片就想玩的游戏了 上一个是2077[笑哭],17,就怕捧太高   2077如果晚一两年发售就完美了
豆豆漢漢滴爹,保密,[笑哭][笑哭]平时都不舍得买游戏。。。但是这个真的会支持一波感受一把。太难得了，,35,确实太难得了呜呜
孤寡老人_灭霸,保密,我是越来越喜欢唢呐了，你快说你也喜欢[脱单doge][脱单doge],13,唢呐一响，黄金万两
Bach张睿达,男,"じゅうよです
这次保真了",13,这会稳了[脱单doge]
我爱黒丝,男,"24年玩黑神话，25年玩gta6
美滋滋[呲牙]",15,美汁汁
恶意阐述事实,保密,现在玩到黑神话是我活下去的动力之一,15,之后就开始期待系列作品[脱单doge]
败犬不需要安可,保密,只要把时间都猜一遍，总有一个会中的,25,排除法是吧
黑岩射手c,保密,其实有没有都无所谓😎,15,[墨镜][响指][大哭]
小麦动漫后序洞态,男,还有八个月二十天就能玩了，想想都积极向上[热],14,7个月加20天，八月不满月
我是逗比不解释,男,明年就30了。电子阳痿已到晚期，4090本来等GTA5，怕是来不及了。就你了！让我最后再战一把！,13,
驾崩的皇帝,保密,这配音真的好代入啊，我一点母语尴尬症都没了,13,以前国漫配音一直很好啊[笑哭]星游记
光与信仰ゃ,男,出必买懂我意思吧？虽然我不太喜欢玩单机游戏，但是我喜欢当齐天大圣！,16,我也是，我都是主要玩手游，这次下血本换电脑只是为了当齐天大圣！
月与夜之歌,保密,不是 拜年视频呢 等的睡不着了,28,已经大年初一的0：30了，还是没有[墨镜]
可乐要热的哟,保密,[doge]8.20 生日当天我必入手PS5专门玩黑悟空,15,我买个4070ti2k拉满玩想想就不要太爽
江口鸟,保密,我从未来穿越回来的，当时我在蹲坑，突然刷到了拜年视频，激动无比，里面好多兔子！,15,
-黄师-,男,看完预告，反而对游戏没那么期待了，而是对黑神话的剧情更感兴趣,15,我也是我也是，就是打不过去，看不来后续剧情[笑哭]
zddd十七章阳货篇-25,保密,b友们特有的心急，不过你别急，我刚从天庭拿的保真消息，8月19号有新视频，应该会是最新消息，有新怪物，敬请期待。,12,真的假的
飘起的清风-,保密,今晚25点有新预告片[给心心],12,错误的，是2月31号中午13点
七日华,保密,其实我一点也不急😎,12,
金苹果味儿的果核,男,好早,15,"距离第一个视频刚好四年啊
四年之期已至，猴王归来！"
Steam-游戏特惠,女,[打call],23,开局五折怎么说[脱单doge]
凉宫春日的缎带,男,每晚都会看一遍预告片和评论区，台词都记住了，无法想象游戏出来的时候，我可能比猴哥从五指山蹦出来还要激动和开心！（hhh开玩笑，有猴哥一半激动就已经很知足勒！）,13,+1，可能19晚上失眠
风逝馀吾,保密,《打开欲网，跳出情牢，放马西行，直面天命》,17,
BubbleSyah,男,坏了，真开美蛙鱼头去了,18,褒姒⚠️
歪曲曲线,保密,候子你现在可真是个香饽饽，某封神[嗑瓜子],12,
-Hadron-,男,啊？！8.20正好是我女朋友生日，让她给我买[doge],14,你是懂过生日的[doge]
Bach张睿达,男,虽然今天也没有，但是拜年视频肯定是有的，再等等吧！,17,[大哭][大哭][大哭]
踢球的小孩,男,2024.8.20是农历七月十七，是民间一些地方纪念的齐天大圣诞辰，说你们是不是2020.8.20就算好的[妙啊],14,细啊，太细了[喜欢]
牢西与呦西游记,保密,属于是赛博烽火戏诸侯了[捂脸],21,
短的发布会,保密,出必买！快点端上来罢[大哭],881,到时候能不能短测评一下
唏嘘猪肉佬O_o,保密,你在大马士革骑过马，在欧洲当过海盗，在美国当过牛仔，在埃及当过刺客。现在你终于可以回到你的家乡，做你自己的英雄了。[打call],21,
RedSkadi,男,本人学生没收入，但是平时省吃俭用，能吃饱就行，没啥特殊爱好，就一个臭打游戏的普通大学生，不过我还是买了，一个月就那点钱游戏月卡也早断了，游戏是不可能再充钱了，虽然这样很双标，但是在我一整个高中和大学的两年时光里一直期待黑神话，我要感谢我的父母，谢谢你们！,19,
博特丶F,男,求你了，发个贺岁片给孩子看看吧[大哭][大哭],18,
伊若枫,保密,256天后，我必如约而至！[脱单doge],22,
落寞橘外人,保密,快发龙年贺岁[星星眼],19,
山茶花不想在故乡骑车,保密,不敢想象明年八月二十我是一个多么开朗的小女孩[星星眼][星星眼][星星眼],27,
账号已注销,保密,听了戒网，把所有素材看了遍，垂直入坑了，对比玩法，更期待剧情[脱单doge],12,戒网确实好听
五菱宏光面包车,男,"这游戏最大的优点就是自己人做的，有些地方他一说咱们一看就知道怎么回事儿。
外国的游戏好是挺好，就是他抛出了一个梗，我们想要了解的话，就得先靠翻译，然后再了解一下这个梗在这个国家怎么来的什么意思，太麻烦了。
国产的话就没这个顾虑了，比如说，他这里假如有个小妖提个什么，我家大王之前一连解决了孙行者，行者孙，者行孙三兄弟。这我们一看就知道这仨是悟空，而且这小妖估计还是平顶山那一块儿的。说的可能不是很贴合，反正大概就是这么个意思。
我自己感觉这么期待国产游戏的一个主要原因，其实就是大家想没有任何障碍的在这个游戏中，直接了当的体会到这款游戏是怎么回事儿讲了个什么故事，一个游戏他的故事感觉还是要占一个很大的比重的。所以对于这游戏最大的期待是他能把剧情做好，玩法上有没有大的亮点无所谓了，一步一步走就得了，这是这家公司的第一个主机游戏吧，没必要说是一步登天，步子大了容易扯着蛋。",12,更希望是悟空选择tga，而不是tga选择悟空。[热]
阿诺真的太逊了,男,加油!为了黑猴已经找到新工作了，发售前升级4080，数字+典藏+手办我全都要[OK][OK],12,有钱银[大哭]
臭屁臭屁虎,保密,"说实话真的等不及了，游戏本身品质我作为一个一般玩家，无可挑剔。然而黑悟空蕴涵的西游文化，以及传承400多年的西游精神被重新解读，并发扬光大无疑才是最让我兴奋的。所谓“天下熙熙皆为利来，天下攘攘皆为利往“，各位面对当下国内游戏市场环境，本着一颗热爱游戏的心，面对一切未知的恐怖，跨越艰难万险，做良心好游戏，又何尝不是另一部“西游记”，我个人由衷钦佩。
为你们点赞，加油，各位取经人。取经之路，我也会一直支持各位，用我微薄的力量
游戏发售时，我要第一时间买来玩。
最后，祝愿游科始终保持这颗热爱游戏的初心，越办越好，拥趸越来越多，把更多饱含中华文化的优秀作品呈现给公众",12,
杨木丶1307,男,今天我要去美院象山了，可以顺便看下游科公司，希望你们后续的工作一切顺利啊。,12,
桜かえで,保密,怎么说呢，期待别太高，要不然失望了，又去刷差评，我期待他的及格成绩，不期待他能考清华北大，中国3a游戏刚起步，这是一次尝试，别到时候因为差评，搞得业内人士都不愿意这种类型的游戏就好，要让国内厂商看到希望，什么是希望？不赔钱，小赚到钱，就行。,12,
关注b站所有美女,保密,求求你把黑神话做完了之后，把中国的其他神话体系给做出来，比如说封神演义，山海经之类的[星星眼][星星眼][星星眼][星星眼],12,封神演义说实话，原著属于二三流小说，如果选择得大刀阔斧的改。山海经是真的宝藏，不管是做成开放世界，类魂，卡牌等都挺好的。
青石藤,保密,大家这次真别口嗨了，这可能是最有机会改变国内游戏市场的一次，如果这次又叫好不叫座，销量不佳的话。我估计以后游戏市场就永远只能玩劣质的骗氪手游页游，想玩高品质的游戏就只能在欧美日厂里找了。我们自己的文化是永远也体验不到了。,12,大可放心，只狼在小黑盒上统计的都有二百w，这还只是小黑盒用户的u拥有量，国内还有多少人在玩学习版的，只要品质在游戏性在国内肯定不愁销量，要看看能不能在国外也打开市场，只希望ign似一似别影响猴哥声誉
风长于息,保密,IP回来了，真看片了吗？[笑哭],12,
今天又吃土豆炒牛肉,男,快…快端上来罢❤️～啊…啊……已…已经忍…（嘶溜）忍不住了啦❤️要……要要爆炸了啦🥵🥵🥵,12,
水表丿君,男,你再不给哥们拜年，哥们要去给你拜年了👿,17,
咕咕今晚吃什么,保密,我生日前一天卧槽，这么帅，生日礼物,15,
夜饮黄泉,男,出了就买，直接上限定版，太帅了[脱单doge],19,
伪语伤愿,保密,我斩断过不死，传过火，当过艾尔登之王，在西部的原野上弛聘过，接受过青草试炼 阻止过白霜降临，运过行李，装过植入体，抢过美联储，打过僵尸，开过bt，天际省里杀过鸡，教堂塔尖蹦过极，一四一中出过力，致远星上抗过狙。但还是拒绝不了那一声齐天大圣。[doge],17,
雨晋天阳,保密,我曾在欧洲当过刺客，曾在中世纪当过猎魔人，曾在诺曼底冲锋陷阵，曾在西部当过牛仔，曾在岛国当过武士。现在，我要回到我的故乡，当一回我们自己的英雄，那个降妖除魔的齐天大圣,18,
垂直平面,男,430人在看，看来都被英伟达发的视频感染猴瘾了[脱单doge],20,
Ez8-G,男,将军走此小道,14,
玫瑰花的绿,保密,今年的贺岁视频呢,15,
只想留住那一抹时光,保密,开始期待了黑神话杨戬黑神话哪吒[妙啊],21,
東菓-,保密,我看是改编自公元2000年中国网络小说《悟空传》才对,38,
帮我做作业呜呜,女,好家伙，8.20发售。翻看黑神话主页，相对重要的实际测试都是在每年的8.20发的，8.20是有什么特殊含义吗,12,古代祭司大圣的日子
_B站通缉犯,保密,这画质，太有代入感了，不知道4060能带动不？[吃瓜],12,放心吧，带不动也得入手[doge]
ca123in,男,也就是比我预期多9倍的量加9倍的质，可以说是我受到了81层震撼,12,老哥哈哈哈哈哈说的又怪又好的
kirling君,男,审美太绝了，在他们做出黑神话悟空之前，我一直都觉得西游记挺土挺low的，（小时候还挺喜欢看86版西游记，那时候不算）我甚至有一段时间还觉得国内游戏老是以西游记为题材做游戏太没劲了，感觉像在吃老本，应该弄一些新东西出来，但他们做出黑神话悟空之后，我一下子就开始对西游记刮目相看了，太帅了，经典能成为经典不是没有原因的[喜欢]之前是我浅薄了，对不起[大哭],12,这些老本，没有人吃透过，但当一群优秀的实干家把他做出来后，中华文化最狂野原始的魅力赤裸裸的呈现在你面前，就如同喝惯了啤酒马尿，突然来一口陈年老酿的女儿红，自是会让你回味无穷
米尼豬の本體塔,男,感动的是中国的纯正美学艺术，又一次的伫立在世界的舞台上，也是以主角的身份让人们看到并且为之疯狂，再也不是那些，让外人来给你照着他们的想象，臆断出的缝合怪似的割裂文化，深厚的文明积淀是所有成就的大前提，根深才能蒂固，不然再发达的工业，再蓬勃的经济也锻造不出如此丰富多彩的世界观，曾经多少年看到过的大部分其他文化输出，多少都是拿来主义的缝合怪，都带着拿来者自身的文化印记，跟原始的本来文化大相径庭，文化成为他讲故事的点缀物，输出自身的强迫意识才是其真实所求……可以说只有文化的本来国，掌握主导权自己来书写他们自己的文化，才能讲出一个心神统一的故事，想起当年大闹天宫碾压世界的审美趣味，影响了世界多少人对东方的想象，就可见一斑了，这也针对于世界其他文化深厚的文明国度吧！期望以后我们这样的纯正美学作品，再多些…再多些；能独立掌握自身文化的国度，再多些…再多些…不再想看到套壳讲故事的内容泛滥成灾了，受够了那些奶头乐的审美情趣，看不惯本来是陪衬的东西当起了主角，对全世界的美好换来换去………因为你不配！,12,
香菜X彩奈,保密,这原版中配实在是太棒了，果然自己国人做的、以本土文化为背景的游戏，原汁原味的中配最赞了。无论是语境、语调、台词等等都表现得很自然，没有平常那些英译中、日译中的各种违和感，实在大赞啊！！[打call][打call][打call],12,
六柳木林,男,看到这个短片，还没玩到游戏，只是想一想就不禁热泪盈眶，很庆幸能在人生的最绚烂的年华迎来中国游戏新的春天,12,
曾经的我い,保密,建议大家去官网看预告，比b站油管都要高清多了，叔叔码率对半砍,12,
零子若,女,看得颅内高潮，，希望是国产游戏开端，而不是巅峰,12,
永驻心中的彼方,男,我在考虑用PS5玩还是用 PC玩[doge],12,pc玩开光追和dlss好点吧，手感不好的话就把PS5的手柄拿过来
-还是做不到吗,保密,明年我生日当天发售[脱单doge]，纯纯生日礼物,12,提前祝生日快乐
刘刘刘彦昌,男,前排，每年的生日都有期待,18,
天阙戏子,保密,"想你了，牢猴😭
回来吧，我最骄傲的大师兄😭
历历在目的七十二变😭
火眼金睛莫名在流淌😭
依稀记得大闹天宫的齐天大圣😭
还有给力的花果山美猴王😭
把妖魔鬼怪打退都不累的斗战神佛！😭😭",16,
毛线团__,女,这个配音好好啊，不用看字幕也能听清,19,
阿杰_Naher,男,8月20号刚好我生日，还刚好是我18岁生日，这难道也是天命吗？[doge][doge][doge],14,
刻晴-天街巡游,男,我最期待的俩款国产游戏：黑神话悟空，燕云十六声,19,
普通混子人RW,保密,祝发售大卖[打call],16,
爱吃可颂爱吃可颂,男,英伟达的看完了，顺便再来重温一下[呲牙],16,
AY仙鸽,男,白骨之后，重走西游[脱单doge][星星眼],19,
飘芙灵,男,我十分尊重黑神话悟空，就像游科对西游记原著尊重一样[吃瓜],98,
黄昏帐篷,男,"这游戏发布后，我觉得做网文的写小说的，做动画的，做沙雕动画的都要享福了，翻拍成动画，做成沙雕动画，能让更多人更直观的感受这游戏的剧情让这游戏吸引更多的流量，毕竟游戏实况哪有动画香，游戏实况动不动十几个小时，也并不是所有人都看得下去的
而且游戏发布后肯定有很多人想给这游戏写个同人文呐，或者说翻写成漫画呀，翻拍动画之类的毕竟挣钱嘛，不寒碜，再说了写成漫画花翻拍成动画肯定有人看了，还是不少人呢，大家觉得我说的对不对呀？[脱单doge][脱单doge][脱单doge][脱单doge][脱单doge][脱单doge][脱单doge][脱单doge][脱单doge][脱单doge][脱单doge][脱单doge][脱单doge][脱单doge]",11,
炸薯球熬熬,女,他这些游戏肯定是结合了许多中国元素，中国神话元素和历史元素，我就想问这些东西他们有没有一个团队是专门去本地去做考察去做这种专家的采访的呀，就是有没有一个部门是专门干这个的，好想去干这种工作啊啊啊,11,
稻香里的沉淀,保密,希望黑神话大卖，以后什么山海经系列，各类神话故事都有机会看到了,11,我好希望有一个类宝可梦的山海经哦，有生之年等一波。
至圣先师牢二,男,年度最佳不一定，但提名肯定有,11,
变绿红菇,男,这个预告片和《流浪地球2》的《人类股骨》一样，堪称预告片的巅峰之作。,11,
她是明日香,男,中国玩家如果这次游戏质量过关的话，这次真得有钱的捧个钱场，没钱的捧个人场，每一份对黑神话的支持就是中国推开游戏文化输出大门的一份力。,11,
昨日或不在,保密,无数人对于国产3a的渴望，于明日终于寻到那第一缕曙光,11,
和平0102,男,好家伙，标准版首发价出了来看，发现有1000+的朋友一起,11,
AC_君,男,为什么小黄龙会知道大圣拜师的事，这三界应该没有任何人知道悟空拜师三星洞的事啊,11,他附身袁守诚，袁守诚会算卦
ROADHOG-BMF,保密,这可能是我最后一次相信中国人不骗中国人，加油！！！,11,
霜痕Gilgamesh,男,已经为黑神话悟空买了一台PS5,11,上架就入特典
雨落梨花醉海棠,保密,视频刷了不知道几遍了。还记得几个月前带儿子去爬山，给儿子弄了根棍，看着他在那一直打这个打那个的好开心，自己也不由自主的拿过来耍上了[笑哭]这种感觉像是刻在了DNA里。看到这个视频的时候，甚至不需要经过大脑的思考，就想跟着配音一起念，三十五岁的人了，不仅没有觉得羞耻，念出来还觉得好爽[妙啊],11,
晚上才能看星星,保密,一伯天😡,11,
lingkongzz,男,这最后三个月真是度日如年啊[笑哭],11,
ryandeng1117,保密,得不得奖不敢奢望，我真心希望游科大赚特赚[保佑][保佑],11,
必须比划,女,这比建100所孔子学院强多了,16,
水球碳酸拳超人,男,[笑][笑][笑][笑]我已经急了，游科你哄哄我把,14,
流岚料峭,男,太想黑神话成功了，这样后面的封神，水浒，三国之类的就有机会3A化了,13,
_可乐柠檬葡萄蕉,男,这个游戏是我的必买名单，和gta6在我心目中的一样地位,17,
HIanF,保密,拼搏百天，我要玩黑神话悟空[星星眼],12,
艾尼德普色,男,数字豪华版预购，实体光盘收藏，ps5开箱除灰，手柄酒精清洁，这是一个34岁社畜对这款游戏能拿出最大的尊敬,11,我相信肯定有年度最佳的实力
布丁小鱿,女,[热][热]七点半早早在电视机前等，啥也没有,11,哈哈哈笑死啦
手可摘星辰w_,保密,我尼玛，发售日期是我生日啊，我生日，我爱死了,11,真就天命人啊[哦呼]
葛奶奶伊,男,在b战的播放量已经超越GTA6了,11,
无敌暴龙兽shou,男,820生日哥们在属猴，狠狠的买狠狠的支持,11,
濑朝源创,男,还是看中文的得劲儿[打call],15,
南京烤鸭真香,男,最后通碟，褒姒派全体立刻向赢麻派投降！😡,13,
LakePurvavideha,男,"本来是这样的↓
（舅舅来了）
有人问舅舅：要是2号你回个1，是3号你回个2
（然后舅舅回了个“3”）
早说了不是今天[调皮]",16,
Yuanyelilizi_,女,猴哥你还没拜年,15,
Jarker,男,STEAM加入愿望单，PS5即将上线[脱单doge],15,
喜欢我高坚果吗,男,过年了贺岁视频啊啊啊啊,11,
LukerOne,保密,从未如此期待，敢问哪个中国人会对西游记不感兴趣，这次绝不逃单[星星眼][星星眼],12,
咚哥漫画说官方频道,男,快端上来吧！！我新电脑已经预备好了！！预祝黑神话悟空大卖！！！,12,
阿家君,男,连续四天来看一眼了，到底发不发呀？[笑哭],17,
Dark丶Lord,男,14号发，不愧是恋爱模拟游戏[doge],16,
正在敲钟的阿蒙,男,过年了，不来个贺岁的？,12,
似乎打成了共识,男,懂了，gta6避开了黑神话逃到了2025年[歪嘴],12,
HKC惠科视界,女,如果今天就是24年8月20号，你就算是让我开跑车住别墅我也愿意啊！！！！！[给心心][给心心][给心心],13,那么显示器是不是得送几个[doge]
婉儿啊婉儿,保密,要开始攒钱买电脑啦，大家推荐一下合适的电脑，预算不是很够，能玩就行，谢谢[脱单doge][脱单doge][脱单doge][脱单doge][脱单doge][脱单doge][脱单doge][脱单doge][脱单doge][脱单doge][脱单doge],20,直接ps5就好 不需要pc
小白Long-only,男,"这主美不输老贼了吧，我们是不是可以说出那个了[呲牙][呲牙]
2024年度最佳。黑神话 悟空了[打call][打call][打call][打call]安心了。看的我热泪盈眶[大哭][大哭][大哭][大哭]。。",22,不输美末，战神了，甚至更好
魔鏖,保密,"佛陀菩萨已离去，空留东土取经人。
妖魔鬼怪祸人世，西天极乐一场空。
取得真经又如何？水深火热不曾少。
已受苦难八十一，为何世间亦如此？
六道轮回痴人梦，众生所信皆为空。
佛陀断首混善恶，菩萨闭目漠疾苦。
手持神针定沧海，再踏灵山碎佛门。
（即兴作的
）",11,
_-扶风-_,保密,杨奇老师发微博了，早上七点还没睡,11,可能压力好大
哔站首席评论员,保密,龙年视频，当然是龙年发❗❗❗,11,可是前两天开春了，现在就是龙年
枫忆雪_,保密,大家别急，最新爆料，8月19号有新视频,11,
芒果冰OL,男,TGA今年的最佳播片，[委屈]不跳票就是最大的好消息，最后200多天，加油！！！,2878,半藏快解析视频，新切片好多新内容[星星眼]
秋游胭基,男,啊？这几天怎么比过年还热闹,1804,因为今天TGA啊……
毒魂X,男,卧槽，提前过年了！！！,226,你也在？
洛恩佐Lorenzo,保密,黑神话吧吧友打卡处,526,吧主，回哥谭吧，布鲁斯老爷说不揍你了[大哭]
谁在回眸里丶,男,2024.8.20全国放假[脱单doge],68,老板我要请假玩黑神话！[doge]
菜大师LU破天,保密,上次当天命人都在十年前了,360,好经典的三星
清梦巛星河,男,没有PS4的吗[吃瓜]算了，为了悟空去买台PS5吧,21,我就是为了一盘醋才去包的这顿饺子[doge]
风金翎,男,我猜是这个01:10,18,
゙Gundam,保密,最新消息，明天十点,14,每天都是明天10点
摸鱼的Doby,保密,小道消息，2024年8月20日发售黑神话悟空,17,好一个小道消息[惊喜]
何必念念不忘ヾ,男,又有人说14号，人官方也没透露14号发视频吧，这就有点像狼来了,15,我预言13 14 15 16到年末，肯定能发[妙啊]
钓鱼-烧烤-下雨天,保密,大家别急，重大爆料，8月20号游戏发售,21,谢谢你，丁真
小李啊你要振作,男,明天大的，明天没有就一定是明天的明天大的药来[脱单doge][脱单doge],18,我猜8月20来大的[doge]
Morii_行夜北,保密,据A小道消息：买一份黑神话送一份美蛙鱼头[滑稽][脱单doge],11,
蝉鸣半夏呦,保密,彦祖，于晏又按时间顺序看评论呢[脱单doge],14,
一根儿头发丝,女,预购呢，预购呢,13,
思卓如起,保密,我小时候看西游记就只是感觉有意思而已，但是看到黑神话却流泪了，我以为因为他是《国产3A》，是中国文化。但是拨开表象，我发现，我只是简单的喜欢西游记，喜欢孙悟空，被社会毒打了几年后，发现社会上的妖魔鬼怪太多了，你我皆唐僧，不见孙悟空。黑神话或许改变不了你我的生活，但也可能是你我的“灵台方寸山，斜月三星洞”。[拥抱],11,
AosSiDhe,男,杨哥，游戏没这么快出，那音乐能不能先放到音乐平台上售卖啊，我想听三姐四舅完整版。_(:з」∠)_,11,ost和游戏同步上线
托腮的海獭,保密,不知道黑神话三部曲，有没有计划做开放世界呢？我希望三部曲第三部，最好是个完全无缝的开放世界，打BOSS，也不要像艾尔登法环那样，要穿过一阵雾霾，而是去到直接开打，真开放世界,11,肯定有，只是要等。
回向萧瑟处,男,1940年8月20号，八路军打响了百团大战的第一枪，此后的第二第三阶段，共计105个团加入了战斗，重击了日伪军的反动气焰，历史上曾这样评价“极大地振奋了全国的抗战信心”。希望明年8月20号发售的黑神话悟空，也能如百团大战的第一枪一样，燃起国内文娱产业的一把火，成为开端，吸引更多优秀创作者的加入，“极大地振奋全国人民的信心”,11,
超鸥列兵,男,拜年视频有可能是这周六的南小年，要么就是下周一,11,应该是周六
天龙鱼狗Go,男,这也许会是国产大作的一个至关转折点｡ﾟ(ﾟ´Д｀)ﾟ｡,11,٩(๑•̀ ω •́ ๑)۶
满仓一把梭,保密,给我一种，所有妖怪也都在对抗自己的天命一般的感觉。,11,
幸运虾虎鱼,男,"顶真，10：00，你别急
顶真，10：15，你别急
顶真，10：30，你别急
顶真，11：00，你别急
顶真，12：00，你别急
顶真，2月4号，你别急",11,
青石藤,保密,网络游戏管理出台，游科这波是，这波是预知未来。[doge],11,
