User Name,Sex,Comments,Likes,Replies
爆肝毒瘤,保密,第一次觉得真的觉得这种3a中配比英配更有感觉  配的真的不错 游戏画面也能看到用尽心血 这年头能做出这样3A的中国游戏 这种国内市场吃力不讨好 且这种迎难而上的精神实在令人感动 不过感觉老外应该欣赏不出来中文的魅力 哈哈哈哈 只有懂中文的才能品出很多韵味  翻译再怎么好他们还是不明白 去学中文吧 刚出的时候有人会说只狼？魂系?类魂？鬼泣？这种文化入侵太可怕了 一些汉字都被传播成日本的文字 尤其是很多服饰建筑妆容 直接会被老外默认日本东方元素  以后再有优秀的3A出世也会有这样的类比 黑神话？悟空？游戏科学？ 冲！不管怎么样都是跨出了那一步[打call] 我们有自己的3A辣 [脱单doge],9,文明是硬件和软件，文化是杀毒软件，传统文化是我们拥有过的文明，所谓文化入侵和文化输出只是下载安装和传播数据，仅此而已
热爱生活的后浪,保密,再不玩到这个游戏我感觉有麻衣在我身上爬[大哭][大哭],17,你小子[妙啊]
4399小路,男,制作组对8.20这个日子有什么执念[doge],52,贴吧有大佬说，24年8月20日，是农历七月十七，在顺昌这天是拜齐天大圣的，具体可以百度。很难不怀疑三年前就订好发售日期了[笑哭]
不闻外事只读贤书,保密,猖狂的下场[doge],74,看笑了
墨明棋妙”,保密,简介说和TGA宣传片有些不同，各位找到了吗？[脱单doge],35,后面长了点
0n1yluvu,保密,唯一希望这游戏别给破解了 给国产3a留条活路[保佑],17,
TouchRuby,男,"世人都晓黑猴好，唯有预告忘不了，古今吧友在何方，水贴一堆草没了
你 也想看预告?
师傅，你说这世上是预告多，还是跳票多?自是预告多
那为何这贴吧从未太平，舅舅总是横行无忌?
因为没有依据的预告不是预告，是水帖的帮凶
以粉丝心肠，显吧友手段，这就是你的天命
小西天舅舅党，在此恭迎天命人
预告预告，乖乖等游科预告，几个老不死的，谣言传的还挺传神的
难道我吧u的天命，就是经验+3吗?
哪有什么视频?都是贪心!
等游科发了视频，我也去当个黑批玩玩!!!
成了黑批又如何?不还是求之不得，丑态百出吗?!!!
这预告，你还想要吗？",24,
怎么说里,保密,"好好好，正是它🤩
这般游戏，我要下载下来好好研究一番🤗
游科，你我相识一场也是难得😊
不如再帮我一回😌
将……拜年视频留下，我好与吧友交差😈
摘星换斗😡🗡️
野马跳涧🦶🦶🦶
拔🌿！寻🐍！
云开！✊雾散！👊",18,
家住海里郝某人,保密,怎么说,9,其实可以等明年的super
说的道麗,男,发售那天真的是我生日[笑哭],9,送自己一个生日礼物[OK]
胡说-周树人,保密,我个人认为在游戏里在意文化输出的人和在春晚里教育人的导演本质上是一种人，游戏首先要做到的是好玩,9,确实，好玩最重要，个人:好玩＞画面＞剧情＞音乐＞其他
sushi的狂热男粉,男,Steam愿望单排名已上升至第五,9,
HoRoo王者,男,我是未来人，2024年tga年度最佳是黑神话悟空。,9,[doge]那你顺便说说销量如何
半价肥皂,女,叔叔这个码率压得真狠，推荐去官网看，超级超级清晰,9,
泡面蟹,保密,剧情只要过得去就预购，2077我都买了……,9,难绷
阿西吧扎卡,男,话放这了，即使我不会玩魂类，即使这游戏很难多少钱我都买,9,要说像的话是类似战神 不是魂类 你看试玩视频招式灵活多变
发霉的霉菌菇,男,19号过生日 20号出 最幸福的一集[星星眼],9,哇那可太开心了，你能至少开心两天，恭喜
就是四月呗,女,我电脑根本玩不了，我甚至平时不玩游戏，我甚至塞尔达都打不过关，但这个游戏我还是会买,9,你塞尔达在哪玩的
好好好哈哈p,保密,成为我第一个原价买的游戏,9,同
黑神话-悟空的小粉丝,男,一百遍啦[打call][给心心],9,
梦醒现彩虹,女,几年前原本只想简单买一份，但现在我想买顶配版，没别的，单身就是硬气[吃瓜],9,
゚墨鲤,男,答应我，这一次买正版好吗？,9,
徐伦她妈,女,2:18那个怪不就是去年出现的这张图里的这个！！我印象太深刻了，这张图好神,16,
扣1送水蜜桃,保密,褒姒了，跑路了,12,
煜XQ,保密,"没发贺岁片我觉得有以下情况
情况一：优化太忙了没搞[捂脸]
情况二：春节憋了大的[喜欢]
情况三：其实根本没有黑神话悟空，大家都出现了记忆错乱[思考]
情况四：游戏剧情被大改，时间紧任务重[疼]
情况五：游科在做下一部黑神话：原神[打call]
情况六：游科所有人都凭空消失了[嘘声]",45,你说有没有可能是他们去做麻辣鱼头了
拿取一枚硬币,男,小道消息，洛恩佐和米线山明天十点结婚,32,周末不一定，估计要周一发
我才起床_,男,23年立春是十点，正好是发布时间，今年是下午四点多，所以等下午吧大伙[tv_doge],21,"等下午吧
等过年吧
等三月吧
等四月吧
等五月吧
等六月吧
等七月吧
啊发售啦"
拉布拉多拉不拉_,男,看到版号下来的消息我真的很开心，昨天考研出成绩了，虽然不是很高但对得起自己了，算是给了自己一个比较满意的结果。备考那段时间往返图书馆的路上基本上每次都在听黑神话的音乐，明年夏天能玩到黑神话这件事真的是给了我很大的精神支持，感谢游科，夏天见！,19,恭喜上岸
难忘的海角,男,我都不敢想，打出这个操作我会高潮成什么样,12,帅！好振！[脱单doge]
長期食草,男,"目前最担心的几点：
1.主角动作打击效果偏差，持棍架势单一，棍棒打击判定距离过短。
2.喘息音效和打击音效违和感很强，这是国内动画和游戏作品的通病，希望得到重视。正面教材可以参考雾山五行。
3.受击反馈错误，主角跳起滞空时被虎哥猛踹一脚后没有被踹飞出去，而是直接垂直落地出现站立眩晕的硬直，这是非常严重的错误，请重视。",11,"打击音效问题有个做配音的up专门说过，我之前还看到过了，应该会有重视。
希望别翻车"
LordPhilosophy,男,作为一个非魂系玩家来说，看了这些PV都有点想买的冲动了，确实很冲动，但我却有一种就算吃灰也得买得支持的那种感觉（不是道德绑架），也许这就是第一次看到我们中国正统的传统文化站在世界的舞台上吧（游戏圈不太了解，但黑神话确实是我第一次看见），从而萌生了这种比较奇妙的感觉吧。,9,说实话，光是这个美术设计和顶级画质，真的可以买来光风景都行了[大哭]玛德一比一实地考察还原的，都不用去旅游了！！直接在游戏里就能见到了！！！
BG4-MSR,男,实机和和试玩都出了，美术首先是一绝，然后整体质量和可玩性也基本没啥问题了，剩下能翻车的地方也就优化拉胯或者剧情太逆天了,9,从目前剧本来看 是带很大讽刺味道的 应该会很有意思
银叶枫华,保密,明年八月，很好，刚好明年实习了，有实习工资配一台好的配置。[doge],9,
GKTang,保密,可惜我只有1060，估计带不动啊，许愿自己明年8月前涨一波工资，让我下定决心升级配置,9,省吃俭用存点嘛[脱单doge]完善小时候的大圣梦[脱单doge]
哦阿不然嘞,女,不夸张的说，我真的看得流眼泪。感动于制作团队的用心，也感动于老祖宗的艺术审美。,9,
-广场一枚铜币,男,我会买一份，细细品味里面的故事，就像小时候借到一本没看过的《七龙珠》漫画书一样，同学问我为什么看漫画看的那么慢，我说我在想象画面和台词的声音,9,
肿詹,保密,"中国电子游戏最长的河：原神
中国电子游戏最高的山：黑悟空 
比翼双飞 共创辉煌",9,
原来是小丿叁,男,搞个旅游模式，不玩买来看看风景行吗？,9,风灵月影应该会帮助你的
翩翩起舞的大叔,男,七十二变呢！！！[大哭][大哭][大哭][大哭]我猴哥的七十二变怎么没看到！！求求你让我看看,9,七十二变是神通，又不是单纯变化之术
洛水天云,男,明年专升本就算失败了也感慨到这样的巨作现世,9,巧了这不是[doge]
攀升电脑,保密,2024.8.20，直面天命。攀升白泽系列AIPC主机采用最新的英伟达 GeForce RTX™40系列高性能显卡，支持光线追踪与 DLSS 3[星星眼],9,在？抽个4090主机[脱单doge]
既然已成既然,保密,"[笑哭]可以不买,可以观望,千万别碰学习版呀.国产独苗呀[笑哭]",22,没事儿，会支持的都会买正版的，那些想白嫖的，什么国产独苗他们不会管的，而且盗版本来就是单机的一个风险，外国厂商能挺过去，我们国产厂商也应该要能挺过去才能真正站稳脚跟
一根儿头发丝,女,"《等xxxxx，我也去当个天命人玩玩》
大哥，你怎么就倒地了，都说了别立flag[笑哭]",276,欸你怎么似了？[思考]
小笨吞,保密,今年的贺岁片怎么还没端上来,21,2.14  13:28
鼓掌猫猫,保密,受不了了，我现在就要玩黑神话。一拳把地球打爆！！！受不了了，我现在就要玩黑神话。一拳把地球打爆！！！受不了了，我现在就要玩黑神话。一拳把地球打爆！！！受不了了，我现在就要玩黑神话。一拳把地球打爆！！！受不了了，我现在就要玩黑神话。一拳把地球打爆！！！受不了了，我现在就要玩黑神话。一拳把地球打爆！！！受不了了，我现在就要玩黑神话。一拳把地球打爆！！！受不了了，我现在就要玩黑神话。一拳把地球打爆！！！受不了了，我现在就要玩黑神话。一拳把地球打爆！！！受不了了，我现在就要玩黑神话。一拳把地球打爆！！！受不了了，我现在就要玩黑神话。一拳把地球打爆！！！受不了了，我现在就要玩黑神话。一拳把地球打爆！！！受不了了，我现在就要玩黑神话。一拳把地球打爆！！！,18,
AutoPatrick,保密,我的评价是，要想让一个游戏符合预期，就得先降低自己的期望。目前黑神话的热度有点让我感到不安了，魂类游戏自始至终都毕竟是小众的，这么大的关注度带来的跟风体验者如果没能获得自己预期中的体验，又会发生什么呢[藏狐],12,魂类游戏从血源，魂3开始出名，到只狼开始出圈，到法环彻底出圈大卖，再加上各种类魂游戏的产出，早就不是什么小众游戏了。不过，降低预期这点我还是很同意的。
绛珠木草,女,比我想象的还要好[大哭][大哭][大哭]等不了了，快出啊啊啊啊啊啊啊啊啊啊,16,我哭了[大哭]
青石藤,保密,"真的，无论看了多少遍都很感动，https://b23.tv/BV1Lj411s72J ，就像这后面老哥说的一样。国际游戏市场几乎没有中式艺术的游戏。都是日式的，所以导致很多人以倭代唐。很多人把中华文化当成日本文化。黑神话悟空刚开始的时候很多人把悟空当成七龙珠里的悟空，以为这是一个日本游戏。

我们明明在历史文化上源远流长，却为何文化输出如此贫瘠？我玩过太多欧美日厂的大作了，我承认他们都优秀地能称得上第九艺术，可角色扮演类的我玩起来终究有一种割裂感，因为我知道那不是我的文化，与我的世界观相悖。

而现在，我想当一回齐天大圣，把这不公的天空捅出一个窟窿。",13,
黑门游侠-塔里昂,保密,1:05 反复看这一段，还是觉得天命人的衣甲太帅了，佩服游戏的美术设计,17,不太懂古代战甲，不过这看着像唐朝的[妙啊]
箫诚cheng,男,我贺岁短片呢，你这个游戏，你这个粉丝量，你怎么睡得着觉的，你怎么睡得着的,45,图图，谢谢😊
有来有趣火华华,保密,我在想如果四年前没有第一个视频出现，而是平淡地度过这四年，这个视频也只在今年的夏日游戏节发布，游戏在820发售的话，那是多么梦幻的场面。,8,
与黯共舞,保密,明年发售了希望各位别玩学习版，大丈夫有所为有所不为，该花的钱要花，该支持的一定要支持，我想看到的是盛世而不是绝唱[抱拳],9,
byewoman,男,改编自公元1592年中国神魔小说《西游记》，哎，来自于432年后回音啊，真是让人热泪盈眶的浪漫,8,
李鲤鲤c,保密,正好明年7月车贷也刚好还完，8月可以买台新电脑玩黑神话！太棒了啊B友们[打call],9,恭喜恭喜[大笑]
小可爱王遗风,保密,视频都盘包浆了[大哭],8,
春昊小号,保密,24年8月20号，农历七月十七，相传大圣诞生于此日。。。你们早就计划好了一切 是吗[脱单doge],9,真的假的[脸红]
YBB丶Somnus丶M,男,这个是捆仙绳吧。。我主线没看到过啊,8,隐藏线 现在看这个预告片都是隐藏线的好东西
junkguy,男,电子春药了属于是，大家都兴奋是好事，但要清楚自己兴奋的点是不是出自自身，别到时候不符合预期又开始攻击了,22,
灌篮高手c-xk,保密,各位理性,19,"招人视频光b站那个20年就是4千多万播放，这种关注度我只能说是应得的。
“盲目”的自信、曝光过度、名不副实这些用词，我只能说游科还是太踏实太谦虚了；不过这是好事，从官方他自己嘴里说出来的肯定是越谦虚踏实才好。"
Moto-Yuki,保密,还好我早就开始存钱了，一天一块钱，到明年八月二十日直接秒[脱单doge],134,游戏都是小钱，设备才是大头
无尘-微尘,保密,多少钱啊？带我赚下？,19,
有只肘子,男,看原先的预告得砍掉60%以上,14,预告片的boss不都出来了，只是不在预告在的场景，这也不行吗？
一兜冬瓜糖,男,开头这座塔好像泉州开元寺,48,这种塔我老家也有一个类似的，坐标清远英德[哦呼]
望浪丶,男,新的网络游戏管理办法大家都看了吗？游科这波打造第一部国产3A游戏怎么这么牛呢，网络游戏一凉，本身单机游戏玩家基数就还可以，这么一搞直接起飞了，游科作为领先版本的存在，未来的前途一片光明啊！[脱单doge],13,感觉写这个办法的人懂行，而且出这个规定的多少沾点单机婆罗门（无贬义）
海底的烂泥,男,"世人都晓黑猴好，唯有预告忘不了，古今吧友在何方，水贴一堆草没了
你 也想看预告?
师傅，你说这世上是预告多，还是跳票多?自是预告多
那为何这贴吧从未太平，舅舅总是横行无忌?
因为没有依据的预告不是预告，是水帖的帮凶
以粉丝心肠，显吧友手段，这就是你的天命
小西天舅舅党，在此恭迎天命人
预告预告，乖乖等游科预告，几个老不死的，谣言传的还挺传神的
难道我吧u m的天命，就是经验+3 m吗?
哪有什么视频?都是贪心!
等游科发了视频，我也去当个黑批玩玩!!!
成了黑批又如何?不还是求之不得，丑态百出吗?!!!
这预告，你还想要吗？",22,
吔我压路机啦,保密,不是吧友提醒，我都还没发现[点赞],12,
Bach张睿达,男,不建议出线上DEMO，理由是DEMO需要准备，会挤压优化时间。,35,支持
钓鱼的大白鲨,保密,好喜欢这种怪物超多的3a，也期待山海经或者克苏鲁题材的，想想就兴奋[脱单doge],28,
塞拉斯Official,男,[难过],8,游戏还没出，屌图一大堆[笑哭]
骑砍真上头,保密,同学，想玩盗版就偷偷玩，别发出来装逼，这是什么很光彩的事吗？,29,
不可不知的你,保密,这个视频是所有预告里释出信息量最大的一支，重看多次依旧觉得震撼,8,
佐藤kanako,保密,这游戏出了无论定价多少包括游戏质量就算不怎样我也购买支持，支持是因为国内也有厂商有做3A大作了能力了，不像某些厂商科技树都点在二次元网游上,8,
尼卡毁路飞,保密,打击盗版，维护开发者权益！,8,
--溪雲初起日沉閣--,保密,一定要开创意工坊，我想给大圣穿金猴皮鞋[笑哭],8,哈哈哈哈哈哈
Exceed__,保密,啊？8.20号？正好生日当天，看来弼马温心里有我[给心心][给心心],8,
丨なぎさ丨,男,标准版269！！我要豪华版，快端上来[大哭],8,
Delta原创饰品,男,既见如来，为何不BUY？,8,
aroilem,保密,说实话，现在大家对这个游戏的期待值已经超标了。等真出的时候大概率会有很大一部分人失望，搞不好还会有人喷，而且很多可能都是现在在评论区底下疯狂夸的那些人，这种事已经发生的太多了[笑]。,17,那些人真买的还不知道有多少呢
倥偬业火,保密,家人们Aj哥又爆料了：这游戏他下了班每天玩的话能玩一个月。大概换算下来就是30h的体量，绝对量大管饱[打call][打call],14,才30个小时？这么少啊
wdwang123,男,我愿意称黑神话为“伟大的开端”。中国这个世界唯一流传至今的文明古国，拥有超过6000年的历史，若论文化，我想世界上能和这个神秘的东方古国匹敌的寥寥无几，单论1592版西游记的历史都已经远远超过了美国整个国家的历史，但可悲的是今天充斥着社会的，影响着年轻人主流世界观的恰恰是西方文化，西方世界对中国的文化侵略经过几十年的发酵，已经到了一个肉眼可见的程度。我看着那些西方RE视频中的博主看到黑神话时喊出的DRAGON BALL或只狼时，有一种不可名状的悲哀。唐代建筑、盔甲、兵器和陈设什么时候成为日本的文化了？我们有着人类历史上最深厚的文化底蕴，几千年来汉字从未断绝，文化传承从未断绝，综合国力上各朝历代至少主宰世界千年之久，可惜好像整个世界除了我们就没有人知道这些事实了。我们坐拥着丰厚的财富，但却不知道如何向人展示，我们缺少的从来不是底蕴，而是手段和方式。电影和游戏在我看来是集艺术大成之载体，至少包含了绘画，音乐，文学，建筑，戏曲，舞蹈这些内容，如果黑神话能够吹响这游戏业革命，文化转折的号角，那在我心目中，它就是伟大的。往小了说文化能提升归属感，认同感，往大了说，文化能推动人类世界的进步，来自文明古国的文明才是文明。而我作为一个曾经的游戏制作人，我也将我20多年来的希冀托付于黑神话，愿祂终将为列仙班！,11,星球大战那样的太空史诗就不算文明？
墨_笙,男,优化一定要好，别跟隔壁龙之信条2学,20,对[笑哭]
LakePurvavideha,男,闹麻了，昨天出来个“镜头领域大神”说游科镜头有问题，一堆人外行看了视频就真以为对面是大佬了，评论区一个劲的@官方，结果那up连初中都还没毕业[大笑]一个初中生随便剪了几刀的视频就把b友们忽悠的一愣一愣的，还一堆人想让这“大佬”进游科呢[嫌弃]你们让未成年去应聘劳动法同意了吗？,25,
LakePurvavideha,男,"报！紫云山执杖道士赞诗写作已找到其一。
第一句“仙山云水连天涯”，灵感来源于原著第九回渔樵对诗，从两人的鹧鸪天里各选第一句拼合而成，后韵脚沿用“-ia”[给心心]",15,[灵魂出窍][支持]
命运的捉弄R,保密,已经玩上了,19,
辞职回家当橘猫,男,什么才叫顶流，什么才叫爷，你ign骂的最狠，结果打脸也最狠，太痛快了，除了战神甚至没有超过50万的，不要太解气,42,
火红色流量,保密,这画面看着太爽了！期待,19,《子与父》《问了没有》《快上车》
拿取一枚硬币,男,tnnd，为什么不发！（震声拍桌）发！发！不发，不发视频是吧，不发我就串死你，都不敢发，都怕串是吧，我告诉你，不发，不发也白想活着，既然大家都知道了，这戏我就不演了，我就是大名鼎鼎的明日方舟和大原神双料高级特工，代号二刺猿（掷帽于地），米线山是我放的，这评论区的引战我也放了，不过这评论我发了，我肯定得死，你们不发，也白想活着！鹰角网络，大米哈游，我滴任务完成啦，啊哈哈哈，哈哈哈哈。。。,20,
不死的凉翁,保密,拜托啊，点开时间顺序的你真的好狼狈啊[大哭],35,淦啦！[笑哭][笑哭][笑哭]
GlamorousSky,保密,起的真早啊，突然想起来你小子今年没给我拜年呢[保卫萝卜_哇],15,今天有拜年视频
仲沐桐梓,男,八月二十，大圣等你,16,左一是哪部作品
breathxx,保密,菩提树下都是宝 大家学习要趁早  勤学多问为什么 这种态度才算好,8,
Bach张睿达,男,好饿啊，有什么好吃的推荐吗,8,美蛙鱼头
模玩霾,保密,齐天大圣降临来！神兵火急如律令,8,
阿白の信,男,急急急，我现在就要玩到黑神话（爆哭）（疯狂大喊大叫）（嗜睡睡不着失眠）（幽暗的在大地爬行）（倒立发呆）（不穿衣服乱跑）（接受任务）（无奈）（变成迪迦奥特曼）（死死的盯着你）（起飞）（口吐白沫乱甩像大马一样）（骑骆驼）（满地打滚）[大哭][大哭][大哭][大哭][大哭][大哭],8,
倥偬业火,保密,最后95天了[奋斗],8,
赤红shadow,男,100天倒计时了，这么有纪念意义的日子，不给兄弟们整点攒劲的节目吗？[脱单doge],8,
Choreo_JasonHe,保密,"我去，就这？就这！！我呸！涂点口水，数钱！游戏拿来！！！快！
（PS：一句“不知道好歹的善，不叫善，是恶的帮凶”彻底打动了我了）",8,
丶TLN,保密,预告骗,20,
热血超新星,男,虽然明天整活视频，但要是公布售价就好了,16,明天是初五，迎财神，大概率是要公布售价的
萧夜之梦,保密,"致敬所有中国玩家：
  你曾在文艺复兴的欧洲历经磨难，终成一代刺客大师。你曾自由自在纵马驰骋，在美国狂野的西部时代。你曾化身战神，在北欧神话里大杀四方。你曾称为一名狩魔猎人，降妖除魔拯救世界。你曾是一名铁驭，你和你的泰坦炸毁圣柜，拯救了一整个星球的人。你曾在无数个故事里，拯救了无数个世界，你是无数个世界的人眼里的英雄。最终，你终于能回到家乡，做一回自己的英雄，现在你的名字叫做：齐天大圣—孙悟空！
在以前对于我们来说，选择语言界面是这个样子的：Language——简体中文
现在他不一样了，现在他的样子是：语言——English！",12,非我原创
夏沐浅忆-,男,今天到打卡黑神话试玩场馆和游科公司打卡，也算是弥补了一半去年夏天的遗憾吧[笑哭]预祝820大卖，期待大圣归来[打call]游科和大圣新年快乐[给心心],30,可以的
正論大魔王,男,"《只狼青春版》
《感觉不如原神》
《这不纯纯抄袭魂系吗？》
《低配版战神》
《除了画质啥也不是》
《播片游戏，褒姒了》
《骗钱玩意儿不会真的有人信吧？》[doge][doge][doge]",22,旁边英文版还有人说没有中文配音的，真的逆天，全是串子[笑哭]
以钢铁与火之名,保密,夺少年？,100,好家伙
听风化梦,保密,真就不拜年了呗，这可是龙年啊[大哭][大哭],18,我有预感，大的来了
心中的利威尔,女,即将开启中国游戏大变革，结束劣质手游的统治，看看什么是真正的第九艺术,10,
千华-,保密,以后3d区会不会有国外大佬做蜘蛛精们啊，想想就刺激[星星眼]直接把蒂法2b拉下神坛[星星眼],13,你小子[妙啊]
fazias,保密,"好好好，正是它[妙啊]
这般视频，我要缓存好好研究一番
游科，你我相识一场也是难得
不如再帮我个忙
将试玩demo留下，我好向玩家交差。

开心罐头！！！
野马跳涧！！！",14,哈哈哈哈哈
倥偬业火,保密,还有不到48小时更新视频，急急急,16,真的？
人类也曾妄想光,保密,懂了，豹杀只狼[脱单doge],48,哈哈哈
无语呀i,保密,[吃瓜],44,好图[滑稽]
马尔科夫猜疑链,保密,198毫无压力，298正常定价，398咬咬牙，再贵我就得女皇组启动了,8,记得女皇不是退了吗？
芋头不粘牙,男,大圣啊，五指山和炼丹炉都困不住你，8月20号带我们从走一遍取经路吧,8,冲！
wolfofgod,保密,这游戏有佛意，有禅意，中国独有的哲学善恶思想,8,
Estrella2568,男,梦开始的地方 国产3A直面天命 无论你是巅峰还是低谷我都会买这一份国人的梦想,8,
綺羅依,女,一二月打了p3r和relink，三月玩龙信2，六月玩老头环，八月玩黑神话，月月都有新盼头,8,
养鱼舍,保密,中国一直缺乏3a游戏，希望黑神话悟空会是一个开端，只要有开端就也是好的即使最后是答辩我要尝尝咸淡,8,
腿短站不稳,男,最近又有人疯狂带节奏，我始终坚信你们，不要被节奏影响心情，不忘初心，砥砺前行，820我等你！,8,
hhahahahhahahha,保密,c哈哈哈哈哈，我04属猴，而且生日就是0820，我必买不可[doge],8,
白玉碎作尘,保密,想买给男朋友当生日礼物，但是男朋友生日在五月份，所以能不能提前跳票到五月份让我买[doge],8,说不定那时候已经开预购了
账号已注销,保密,兄弟们，离黑神话悟空发售还有129天，贼期待[打call],8,
